{
  "$schema": "https://json-schema.org/draft/2020-12/schema",
  "$id": "https://scada.local/schemas/screen-definition.schema.json",
  "title": "ScreenDefinition",
  "type": "object",
  "additionalProperties": false,
  "properties": {
    "schema_version": { "type": "string", "minLength": 1 },
    "screen_id": { "type": "string", "minLength": 1 },
    "project_id": { "type": "string", "minLength": 1 },
    "name": { "type": "string", "minLength": 1 },
    "canvas_width": { "type": "integer", "minimum": 1 },
    "canvas_height": { "type": "integer", "minimum": 1 },
    "objects": {
      "type": "array",
      "items": {
        "type": "object",
        "additionalProperties": false,
        "properties": {
          "object_id": { "type": "string", "minLength": 1 },
          "svg_asset_id": { "type": "string", "minLength": 1 },
          "x": { "type": "number" },
          "y": { "type": "number" },
          "width": { "type": "number", "exclusiveMinimum": 0 },
          "height": { "type": "number", "exclusiveMinimum": 0 },
          "tag_bindings": {
            "type": "object",
            "additionalProperties": { "type": "string" }
          },
          "modify_rules": {
            "type": "array",
            "items": {
              "type": "object",
              "additionalProperties": false,
              "properties": {
                "property": { "type": "string", "minLength": 1 },
                "binding_key": { "type": "string", "minLength": 1 },
                "true_value": { "type": "string" },
                "false_value": { "type": "string" },
                "condition": { "$ref": "#/$defs/ModifyRuleCondition" }
              },
              "required": ["property", "binding_key"]
            }
          }
        },
        "required": ["object_id", "svg_asset_id", "x", "y", "width", "height"]
      }
    }
  },
  "$defs": {
    "ModifyRuleCondition": {
      "type": "object",
      "additionalProperties": false,
      "properties": {
        "op": {
          "type": "string",
          "enum": ["eq", "ne", "gt", "gte", "lt", "lte", "between", "in"]
        },
        "value": {},
        "min": { "type": "number" },
        "max": { "type": "number" },
        "values": {
          "type": "array",
          "items": {}
        },
        "all": {
          "type": "array",
          "items": { "$ref": "#/$defs/ModifyRuleCondition" }
        },
        "any": {
          "type": "array",
          "items": { "$ref": "#/$defs/ModifyRuleCondition" }
        }
      },
      "anyOf": [
        { "required": ["op"] },
        { "required": ["all"] },
        { "required": ["any"] }
      ],
      "allOf": [
        {
          "if": { "properties": { "op": { "const": "eq" } }, "required": ["op"] },
          "then": { "required": ["value"] }
        },
        {
          "if": { "properties": { "op": { "const": "ne" } }, "required": ["op"] },
          "then": { "required": ["value"] }
        },
        {
          "if": { "properties": { "op": { "const": "gt" } }, "required": ["op"] },
          "then": { "required": ["value"] }
        },
        {
          "if": { "properties": { "op": { "const": "gte" } }, "required": ["op"] },
          "then": { "required": ["value"] }
        },
        {
          "if": { "properties": { "op": { "const": "lt" } }, "required": ["op"] },
          "then": { "required": ["value"] }
        },
        {
          "if": { "properties": { "op": { "const": "lte" } }, "required": ["op"] },
          "then": { "required": ["value"] }
        },
        {
          "if": { "properties": { "op": { "const": "between" } }, "required": ["op"] },
          "then": { "required": ["min", "max"] }
        },
        {
          "if": { "properties": { "op": { "const": "in" } }, "required": ["op"] },
          "then": {
            "required": ["values"],
            "properties": {
              "values": {
                "type": "array",
                "minItems": 1,
                "items": {}
              }
            }
          }
        }
      ]
    }
  },
  "required": ["schema_version", "screen_id", "project_id", "name", "canvas_width", "canvas_height", "objects"]
}

